{
  "@type": "Dataset",
  "relatedIdentifiers": [
    {
      "identifier": "phs001143.v1.p1",
      "identifierSource": "dbGAP",
      "relationType": "parentStudy"
    }
  ],
  "identifier": {
    "identifier": "phs001143.v1.p1"
  },
  "dates": [
    {
      "date": "20160608",
      "type": {
        "value": "created"
      }
    },
    {
      "date": "20170608",
      "type": {
        "value": "modified"
      }
    }
  ],
  "title": "NHLBI TOPMed: The Genetics and Epidemiology of Asthma in Barbados",
  "description": "Asthma is a complex disease where the interplay between genetic factors and environmental exposures influences susceptibility and disease prognosis. Asthmatics of African descent tend to have more severe asthma and more severe clinical symptoms than individuals of European ancestry. The baseline prevalence of asthma in Barbados is high (~20%), and from admixture analyses, we have determined that the proportion of African ancestry among Barbadian founders is similar to U.S. African Americans, rendering this a unique population to disentangle the genetic basis for asthma disparities among African ancestry populations in general. We therefore performed whole genome sequencing on 1,100 individuals from the Barbados Genetics of Asthma Study (BAGS), in order to generate additional discovery of rare and structural variants that may control risk to asthma.",
  "storedIn": {
    "@type": "DataRepository",
    "name": "dbGaP"
  },
  "producedBy": {
    "@type": "Study",
    "types": [
      {
        "value": ""
      }
    ],
    "name": "",
    "studyGroups": [
      {
        "@type": "StudyGroup",
        "name": "Exchange Area (IRB)",
        "extraProperties": [
          {
            "category": "ConsentAbbrev",
            "values": [
              "EA-IRB"
            ]
          },
          {
            "values": [
              "Yes"
            ],
            "category": "IrbRequired"
          },
          {
            "values": [
              "Use by NHLBI WGS study investigators only. There is one consent group for this study: GRU-IRB. Use of the data is limited only by the terms of the model Data Use Certification. Requestor must provide documentation of local IRB approval."
            ],
            "category": "UseLimitation"
          }
        ],
        "identifier": {
          "identifier": "999"
        }
      }
    ],
    "input": [
      {
        "@type": "Material",
        "name": "",
        "bearerOfDisease": [
          {
            "@type": "Disease",
            "name": "Asthma",
            "extraProperties": [
              {
                "category": "vocab_source",
                "values": [
                  "MESH"
                ]
              }
            ]
          }
        ]
      }
    ],
    "schedulesActivity": [
      {
        "@type": "Activity",
        "description": "TOPMed Whole Genome Sequencing Project",
        "extraProperties": [
          {
            "category": "urlToHtml",
            "values": [
              "http://www.ncbi.nlm.nih.gov/projects/gap/cgi-bin/document.cgi?study_id=phs001143.v1.p1&phd=6969"
            ]
          },
          {
            "category": "urlToXml",
            "values": [
              "http://www.ncbi.nlm.nih.gov/projects/gap/cgi-bin/GetDocumentXml.cgi?document_id=phd006969.2"
            ]
          },
          {
            "values": [
              "public"
            ],
            "category": "displayStatus"
          },
          {
            "values": [
              "public"
            ],
            "category": "xmlStatus"
          }
        ],
        "keywords": [
          {
            "value": "protocol"
          }
        ],
        "startDate": {
          "date": "20170403",
          "type": {
            "value": "start"
          }
        },
        "identifier": {
          "identifier": "phd006969.2"
        },
        "dates": [
          {
            "date": "20170608",
            "type": {
              "value": "modified"
            }
          }
        ],
        "relatedIdentifiers": [
          {
            "identifier": "TOPMed_for_dbGaP_April2016_v5_final.docx",
            "identifierSource": "",
            "relationType": ""
          }
        ],
        "name": "TOPMed Whole Genome Sequencing Project"
      },
      {
        "@type": "Activity",
        "description": "Asthma / Affection Status",
        "extraProperties": [
          {
            "category": "urlToHtml",
            "values": [
              "http://www.ncbi.nlm.nih.gov/projects/gap/cgi-bin/document.cgi?study_id=phs001143.v1.p1&phd=6974"
            ]
          },
          {
            "category": "urlToXml",
            "values": [
              "http://www.ncbi.nlm.nih.gov/projects/gap/cgi-bin/GetDocumentXml.cgi?document_id=phd006974.1"
            ]
          },
          {
            "values": [
              "public"
            ],
            "category": "displayStatus"
          },
          {
            "values": [
              "public"
            ],
            "category": "xmlStatus"
          }
        ],
        "keywords": [
          {
            "value": "protocol"
          }
        ],
        "startDate": {
          "date": "20161101",
          "type": {
            "value": "start"
          }
        },
        "identifier": {
          "identifier": "phd006974.1"
        },
        "dates": [
          {
            "date": "20161101",
            "type": {
              "value": "modified"
            }
          }
        ],
        "relatedIdentifiers": [
          {
            "identifier": "Asthma.docx",
            "identifierSource": "",
            "relationType": ""
          }
        ],
        "name": "Asthma / Affection Status"
      }
    ],
    "selectionCriteria": [
      {
        "value": "DNA samples of 1100 individuals from 190 Barbados families were whole genome sequenced (asthma cases and controls). Among all cases, asthma was defined as both a reported history of asthma and a documented history of physician-diagnosed asthma (past or current). For each of the asthma studies, a standardized questionnaire based on either American Thoracic Society or International Study of Asthma and Allergy in Childhood questionnaires was administered by a clinical coordinator. The identity and relationships of individuals were checked using IBD estimates, and individuals were excluded if discrepant. Samples that failed whole genome sequencing quality control were also excluded."
      }
    ],
    "schedulesDataAcquisition": [
      {
        "@type": "DataAcquisition",
        "name": "",
        "uses": [
          {
            "@type": "Software",
            "name": ""
          }
        ]
      }
    ]
  },
  "creators": [
    {
      "@type": "Organization",
      "extraProperties": [
        {
          "category": "DacEmail",
          "values": [
            ""
          ]
        },
        {
          "category": "DacPhone",
          "values": [
            ""
          ]
        },
        {
          "category": "DacUrl",
          "values": [
            ""
          ]
        }
      ],
      "identifier": {
        "identifier": "0"
      },
      "name": "National Heart, Lung, and Blood Institute DAC",
      "abbreviation": "NHLBI"
    },
    {
      "@type": "Person",
      "affiliations": [
        {
          "@type": "Organization",
          "name": "University of Colorado, Denver, CO, USA"
        }
      ],
      "fullName": "Kathleen Barnes, PhD"
    }
  ],
  "licenses": [
    {
      "@type": "License",
      "extraProperties": [
        {
          "category": "para",
          "values": [
            "http://dbgap.ncbi.nlm.nih.gov/aa/wga.cgi?page=DUC&view_pdf&stacc=phs001143.v1.p1"
          ]
        },
        {
          "values": [
            "yes"
          ],
          "category": "Policy DisplayPublicSummary"
        },
        {
          "values": [
            "yes"
          ],
          "category": "DisplayResearchStatement"
        },
        {
          "category": "FileName",
          "values": [
            ""
          ]
        },
        {
          "category": "FilePath",
          "values": [
            "https://dbgap.ncbi.nlm.nih.gov/aa/wga.cgi?page=DUC&view_pdf&stacc=phs001143.v1.p1"
          ]
        },
        {
          "category": "EmbargoLength",
          "values": [
            "0"
          ]
        },
        {
          "category": "PdfSupplementReqired",
          "values": [
            "yes"
          ]
        },
        {
          "category": "WeeksCancelRequest",
          "values": [
            "8"
          ]
        },
        {
          "category": "YearsUntilRenewal",
          "values": [
            "1"
          ]
        },
        {
          "category": "Configuration DisplayPublicSummary",
          "values": [
            "yes"
          ]
        }
      ],
      "identifier": {
        "identifier": "phs001143.v1.p1_policy"
      },
      "name": "Data Use Certificate"
    }
  ],
  "acknowledges": [],
  "primaryPublications": [
    {
      "@type": "Publication",
      "identifier": {
        "identifier": "pmid:19910028",
        "identifierSource": "pmid"
      },
      "publicationVenue": ""
    }
  ],
  "extraProperties": [
    {
      "values": [
        "NHLBI TOPMed: The Genetics and Epidemiology of Asthma in Barbados"
      ],
      "category": "StudyNameReportPage"
    }
  ],
  "distributions": [
    {
      "@type": "DatasetDistribution",
      "access": {
        "@type": "Access",
        "accessURL": "",
        "landingPage": ""
      }
    }
  ],
  "types": [
    {}
  ]
}